{
  "lease_id": "LEASE-PILOT-0001",
  "task_id": "TASK-PILOT-0001",
  "dispatch_id": "DISPATCH-PILOT-0001",
  "claimed_by": "worker-agent-id",
  "node_id": "node-local-pilot-01",
  "claimed_at": "2026-05-30T00:02:00Z",
  "lease_until": "2026-05-30T00:32:00Z",
  "status": "released",
  "claim_proof": {
    "method": "hash_chain",
    "node_id": "node-local-pilot-01",
    "agent_id": "worker-agent-id",
    "timestamp": "2026-05-30T00:02:00Z",
    "value": "PLACEHOLDER_CLAIM_PROOF"
  },
  "source_refs": [
    "bridge_objects/task_dispatch.json"
  ]
}
